{
  "schema_version": "1flowbase.model-pricing-source/v2",
  "provider_code": "nano-gpt",
  "upstream_model_id": "openai/gpt-5.6-luna",
  "currency_code": "USD",
  "effective_to": null,
  "timezone": "UTC",
  "weekday_mask": 127,
  "local_time_start": null,
  "local_time_end": null,
  "priority": 0,
  "enabled": true,
  "input_token_unit_size": 1000000,
  "input_token_unit_price": "0.2",
  "output_token_unit_size": 1000000,
  "output_token_unit_price": "1.2",
  "cache_hit_token_unit_size": 1000000,
  "cache_hit_token_unit_price": "0.02",
  "cache_write_token_unit_size": 1000000,
  "cache_write_token_unit_price": "0.25",
  "id": "6afa5f97-9dea-49c0-926b-8d8887f5bb4f",
  "effective_from": "2026-10-31T02:01:38.612Z",
  "rules": [],
  "extensions": {
    "source": "community_pricing",
    "price_sync": {
      "synced_at": "2026-10-31T02:01:38.612Z",
      "meters": {
        "input": {
          "source": "models.dev",
          "provider": "nano-gpt",
          "model": "openai/gpt-5.6-luna",
          "field": "cost.input",
          "url": "https://models.dev/api.json"
        },
        "output": {
          "source": "models.dev",
          "provider": "nano-gpt",
          "model": "openai/gpt-5.6-luna",
          "field": "cost.output",
          "url": "https://models.dev/api.json"
        },
        "cache_hit": {
          "source": "models.dev",
          "provider": "nano-gpt",
          "model": "openai/gpt-5.6-luna",
          "field": "cost.cache_read",
          "url": "https://models.dev/api.json"
        },
        "cache_write": {
          "source": "models.dev",
          "provider": "nano-gpt",
          "model": "openai/gpt-5.6-luna",
          "field": "cost.cache_write",
          "url": "https://models.dev/api.json"
        }
      },
      "rules": []
    }
  }
}
