{
  "schema_version": "1flowbase.model-pricing-source/v2",
  "provider_code": "github-copilot",
  "upstream_model_id": "gpt-6.1-terra",
  "currency_code": "USD",
  "effective_to": null,
  "timezone": "UTC",
  "weekday_mask": 127,
  "local_time_start": null,
  "local_time_end": null,
  "priority": 0,
  "enabled": true,
  "input_token_unit_size": 1000000,
  "input_token_unit_price": "1",
  "output_token_unit_size": 1000000,
  "output_token_unit_price": "5",
  "cache_hit_token_unit_size": 1000000,
  "cache_hit_token_unit_price": "0.05",
  "cache_write_token_unit_size": 1000000,
  "cache_write_token_unit_price": "1.25",
  "id": "59a6d265-1105-4ed4-9dc7-a1310ed8a871",
  "effective_from": "2026-10-31T02:01:38.612Z",
  "rules": [
    {
      "when": {
        "input_tokens": {
          "operator": "gt",
          "value": 272000
        }
      },
      "overrides": {
        "input_token_unit_price": "2",
        "output_token_unit_price": "7.5",
        "cache_hit_token_unit_price": "0.1",
        "cache_write_token_unit_price": "2.5"
      }
    }
  ],
  "extensions": {
    "source": "community_pricing",
    "price_sync": {
      "synced_at": "2026-10-31T02:01:38.612Z",
      "meters": {
        "input": {
          "source": "models.dev",
          "provider": "github-copilot",
          "model": "gpt-6.1-terra",
          "field": "cost.input",
          "url": "https://models.dev/api.json"
        },
        "output": {
          "source": "models.dev",
          "provider": "github-copilot",
          "model": "gpt-6.1-terra",
          "field": "cost.output",
          "url": "https://models.dev/api.json"
        },
        "cache_hit": {
          "source": "models.dev",
          "provider": "github-copilot",
          "model": "gpt-6.1-terra",
          "field": "cost.cache_read",
          "url": "https://models.dev/api.json"
        },
        "cache_write": {
          "source": "models.dev",
          "provider": "github-copilot",
          "model": "gpt-6.1-terra",
          "field": "cost.cache_write",
          "url": "https://models.dev/api.json"
        }
      },
      "rules": [
        {
          "when": {
            "input_tokens": {
              "operator": "gt",
              "value": 272000
            }
          },
          "overrides": {
            "input_token_unit_price": "2",
            "output_token_unit_price": "7.5",
            "cache_hit_token_unit_price": "0.1",
            "cache_write_token_unit_price": "2.5"
          }
        }
      ]
    }
  }
}
