{
  "schema_version": "1flowbase.model-pricing-source/v2",
  "provider_code": "bedrock_converse",
  "upstream_model_id": "anthropic.claude-opus-4-1-20250805-v1:0",
  "currency_code": "USD",
  "effective_to": null,
  "timezone": "UTC",
  "weekday_mask": 127,
  "local_time_start": null,
  "local_time_end": null,
  "priority": 0,
  "enabled": true,
  "input_token_unit_size": 1000000,
  "input_token_unit_price": "15",
  "output_token_unit_size": 1000000,
  "output_token_unit_price": "75",
  "cache_hit_token_unit_size": 1000000,
  "cache_hit_token_unit_price": "1.5",
  "cache_write_token_unit_size": 1000000,
  "cache_write_token_unit_price": "18.75",
  "id": "34b7fbb6-49f0-4dd9-85bf-c4ddc1992a2d",
  "effective_from": "2026-10-31T02:01:38.612Z",
  "rules": [],
  "extensions": {
    "source": "community_pricing",
    "price_sync": {
      "synced_at": "2026-10-31T02:01:38.612Z",
      "meters": {
        "input": {
          "source": "litellm",
          "provider": "bedrock_converse",
          "model": "anthropic.claude-opus-4-1-20250805-v1:0",
          "field": "input_cost_per_token",
          "url": "https://raw.githubusercontent.com/BerriAI/litellm/main/model_prices_and_context_window.json"
        },
        "output": {
          "source": "litellm",
          "provider": "bedrock_converse",
          "model": "anthropic.claude-opus-4-1-20250805-v1:0",
          "field": "output_cost_per_token",
          "url": "https://raw.githubusercontent.com/BerriAI/litellm/main/model_prices_and_context_window.json"
        },
        "cache_hit": {
          "source": "litellm",
          "provider": "bedrock_converse",
          "model": "anthropic.claude-opus-4-1-20250805-v1:0",
          "field": "cache_read_input_token_cost",
          "url": "https://raw.githubusercontent.com/BerriAI/litellm/main/model_prices_and_context_window.json"
        },
        "cache_write": {
          "source": "litellm",
          "provider": "bedrock_converse",
          "model": "anthropic.claude-opus-4-1-20250805-v1:0",
          "field": "cache_creation_input_token_cost",
          "url": "https://raw.githubusercontent.com/BerriAI/litellm/main/model_prices_and_context_window.json"
        }
      },
      "rules": []
    }
  }
}
