{
  "schema_version": "1flowbase.model-pricing-source/v2",
  "provider_code": "amazon-bedrock",
  "upstream_model_id": "jp.anthropic.claude-opus-5",
  "currency_code": "USD",
  "effective_to": null,
  "timezone": "UTC",
  "weekday_mask": 127,
  "local_time_start": null,
  "local_time_end": null,
  "priority": 0,
  "enabled": true,
  "input_token_unit_size": 1000000,
  "input_token_unit_price": "5.5",
  "output_token_unit_size": 1000000,
  "output_token_unit_price": "27.5",
  "cache_hit_token_unit_size": 1000000,
  "cache_hit_token_unit_price": "0.55",
  "cache_write_token_unit_size": 1000000,
  "cache_write_token_unit_price": "6.875",
  "id": "41f35ba0-34bd-485b-b6a6-2cc445a9c040",
  "effective_from": "2026-10-31T02:01:38.612Z",
  "rules": [],
  "extensions": {
    "source": "community_pricing",
    "price_sync": {
      "synced_at": "2026-10-31T02:01:38.612Z",
      "meters": {
        "input": {
          "source": "models.dev",
          "provider": "amazon-bedrock",
          "model": "jp.anthropic.claude-opus-5",
          "field": "cost.input",
          "url": "https://models.dev/api.json"
        },
        "output": {
          "source": "models.dev",
          "provider": "amazon-bedrock",
          "model": "jp.anthropic.claude-opus-5",
          "field": "cost.output",
          "url": "https://models.dev/api.json"
        },
        "cache_hit": {
          "source": "models.dev",
          "provider": "amazon-bedrock",
          "model": "jp.anthropic.claude-opus-5",
          "field": "cost.cache_read",
          "url": "https://models.dev/api.json"
        },
        "cache_write": {
          "source": "models.dev",
          "provider": "amazon-bedrock",
          "model": "jp.anthropic.claude-opus-5",
          "field": "cost.cache_write",
          "url": "https://models.dev/api.json"
        }
      },
      "rules": []
    }
  }
}
