{
  "schema_version": "1flowbase.model-pricing-source/v2",
  "provider_code": "kilo",
  "upstream_model_id": "google/gemini-3.6-flash",
  "currency_code": "USD",
  "effective_to": null,
  "timezone": "UTC",
  "weekday_mask": 127,
  "local_time_start": null,
  "local_time_end": null,
  "priority": 0,
  "enabled": true,
  "input_token_unit_size": 1000000,
  "input_token_unit_price": "0.375",
  "output_token_unit_size": 1000000,
  "output_token_unit_price": "1.875",
  "cache_hit_token_unit_size": 1000000,
  "cache_hit_token_unit_price": "0.0375",
  "cache_write_token_unit_size": 1000000,
  "cache_write_token_unit_price": "0.020833",
  "id": "731c8aa4-d600-4fd3-a5a8-17def51e1782",
  "effective_from": "2026-10-31T02:01:38.612Z",
  "rules": [],
  "extensions": {
    "source": "community_pricing",
    "price_sync": {
      "synced_at": "2026-10-31T02:01:38.612Z",
      "meters": {
        "input": {
          "source": "models.dev",
          "provider": "kilo",
          "model": "google/gemini-3.6-flash",
          "field": "cost.input",
          "url": "https://models.dev/api.json"
        },
        "output": {
          "source": "models.dev",
          "provider": "kilo",
          "model": "google/gemini-3.6-flash",
          "field": "cost.output",
          "url": "https://models.dev/api.json"
        },
        "cache_hit": {
          "source": "models.dev",
          "provider": "kilo",
          "model": "google/gemini-3.6-flash",
          "field": "cost.cache_read",
          "url": "https://models.dev/api.json"
        },
        "cache_write": {
          "source": "models.dev",
          "provider": "kilo",
          "model": "google/gemini-3.6-flash",
          "field": "cost.cache_write",
          "url": "https://models.dev/api.json"
        }
      },
      "rules": []
    }
  }
}
