{
  "schema_version": "1flowbase.model-pricing-source/v2",
  "provider_code": "bedrock_converse",
  "upstream_model_id": "jp.anthropic.claude-sonnet-4-6",
  "currency_code": "USD",
  "effective_to": null,
  "timezone": "UTC",
  "weekday_mask": 127,
  "local_time_start": null,
  "local_time_end": null,
  "priority": 0,
  "enabled": true,
  "input_token_unit_size": 1000000,
  "input_token_unit_price": "3.3",
  "output_token_unit_size": 1000000,
  "output_token_unit_price": "16.5",
  "cache_hit_token_unit_size": 1000000,
  "cache_hit_token_unit_price": "0.33",
  "cache_write_token_unit_size": 1000000,
  "cache_write_token_unit_price": "4.125",
  "id": "0c82a51b-0bcb-4984-aec6-d83bce123e3b",
  "effective_from": "2026-10-31T02:01:38.612Z",
  "rules": [
    {
      "when": {
        "cache_write_ttl_seconds": 3600
      },
      "overrides": {
        "cache_write_token_unit_price": "6.6"
      }
    }
  ],
  "extensions": {
    "source": "community_pricing",
    "price_sync": {
      "synced_at": "2026-10-31T02:01:38.612Z",
      "meters": {
        "input": {
          "source": "litellm",
          "provider": "bedrock_converse",
          "model": "jp.anthropic.claude-sonnet-4-6",
          "field": "input_cost_per_token",
          "url": "https://raw.githubusercontent.com/BerriAI/litellm/main/model_prices_and_context_window.json"
        },
        "output": {
          "source": "litellm",
          "provider": "bedrock_converse",
          "model": "jp.anthropic.claude-sonnet-4-6",
          "field": "output_cost_per_token",
          "url": "https://raw.githubusercontent.com/BerriAI/litellm/main/model_prices_and_context_window.json"
        },
        "cache_hit": {
          "source": "litellm",
          "provider": "bedrock_converse",
          "model": "jp.anthropic.claude-sonnet-4-6",
          "field": "cache_read_input_token_cost",
          "url": "https://raw.githubusercontent.com/BerriAI/litellm/main/model_prices_and_context_window.json"
        },
        "cache_write": {
          "source": "litellm",
          "provider": "bedrock_converse",
          "model": "jp.anthropic.claude-sonnet-4-6",
          "field": "cache_creation_input_token_cost",
          "url": "https://raw.githubusercontent.com/BerriAI/litellm/main/model_prices_and_context_window.json"
        }
      },
      "rules": [
        {
          "when": {
            "cache_write_ttl_seconds": 3600
          },
          "overrides": {
            "cache_write_token_unit_price": "6.6"
          }
        }
      ]
    }
  }
}
