{
  "schema_version": "1flowbase.model-pricing-source/v2",
  "provider_code": "kilo",
  "upstream_model_id": "openai/gpt-6-astra",
  "currency_code": "USD",
  "effective_to": null,
  "timezone": "UTC",
  "weekday_mask": 127,
  "local_time_start": null,
  "local_time_end": null,
  "priority": 0,
  "enabled": true,
  "input_token_unit_size": 1000000,
  "input_token_unit_price": "10",
  "output_token_unit_size": 1000000,
  "output_token_unit_price": "50",
  "cache_hit_token_unit_size": 1000000,
  "cache_hit_token_unit_price": "1",
  "cache_write_token_unit_size": 1000000,
  "cache_write_token_unit_price": "12.5",
  "id": "3b5e6f97-59aa-4b8a-893d-dfdfe81bbd5f",
  "effective_from": "2026-10-31T02:01:38.612Z",
  "rules": [],
  "extensions": {
    "source": "community_pricing",
    "price_sync": {
      "synced_at": "2026-10-31T02:01:38.612Z",
      "meters": {
        "input": {
          "source": "models.dev",
          "provider": "kilo",
          "model": "openai/gpt-6-astra",
          "field": "cost.input",
          "url": "https://models.dev/api.json"
        },
        "output": {
          "source": "models.dev",
          "provider": "kilo",
          "model": "openai/gpt-6-astra",
          "field": "cost.output",
          "url": "https://models.dev/api.json"
        },
        "cache_hit": {
          "source": "models.dev",
          "provider": "kilo",
          "model": "openai/gpt-6-astra",
          "field": "cost.cache_read",
          "url": "https://models.dev/api.json"
        },
        "cache_write": {
          "source": "models.dev",
          "provider": "kilo",
          "model": "openai/gpt-6-astra",
          "field": "cost.cache_write",
          "url": "https://models.dev/api.json"
        }
      },
      "rules": []
    }
  }
}
