{
  "schema_version": "1flowbase.model-pricing-source/v2",
  "provider_code": "openrouter",
  "upstream_model_id": "google/gemini-3.1-pro-preview",
  "currency_code": "USD",
  "effective_to": null,
  "timezone": "UTC",
  "weekday_mask": 127,
  "local_time_start": null,
  "local_time_end": null,
  "priority": 0,
  "enabled": true,
  "input_token_unit_size": 1000000,
  "input_token_unit_price": "2",
  "output_token_unit_size": 1000000,
  "output_token_unit_price": "12",
  "cache_hit_token_unit_size": 1000000,
  "cache_hit_token_unit_price": "0.2",
  "cache_write_token_unit_size": 1000000,
  "cache_write_token_unit_price": "0.375",
  "id": "68954be9-96ca-4ca5-8cd5-dbd519c6746e",
  "effective_from": "2026-10-31T02:01:38.612Z",
  "rules": [
    {
      "when": {
        "input_tokens": {
          "operator": "gt",
          "value": 200000
        }
      },
      "overrides": {
        "input_token_unit_price": "4",
        "output_token_unit_price": "18",
        "cache_hit_token_unit_price": "0.4"
      }
    }
  ],
  "extensions": {
    "source": "community_pricing",
    "price_sync": {
      "synced_at": "2026-10-31T02:01:38.612Z",
      "meters": {
        "input": {
          "source": "models.dev",
          "provider": "openrouter",
          "model": "google/gemini-3.1-pro-preview",
          "field": "cost.input",
          "url": "https://models.dev/api.json"
        },
        "output": {
          "source": "models.dev",
          "provider": "openrouter",
          "model": "google/gemini-3.1-pro-preview",
          "field": "cost.output",
          "url": "https://models.dev/api.json"
        },
        "cache_hit": {
          "source": "models.dev",
          "provider": "openrouter",
          "model": "google/gemini-3.1-pro-preview",
          "field": "cost.cache_read",
          "url": "https://models.dev/api.json"
        },
        "cache_write": {
          "source": "models.dev",
          "provider": "openrouter",
          "model": "google/gemini-3.1-pro-preview",
          "field": "cost.cache_write",
          "url": "https://models.dev/api.json"
        }
      },
      "rules": [
        {
          "when": {
            "input_tokens": {
              "operator": "gt",
              "value": 200000
            }
          },
          "overrides": {
            "input_token_unit_price": "4",
            "output_token_unit_price": "18",
            "cache_hit_token_unit_price": "0.4"
          }
        }
      ]
    }
  }
}
