{
  "schema_version": "1flowbase.model-pricing-source/v2",
  "provider_code": "kilo",
  "upstream_model_id": "~google/gemini-flash-latest",
  "currency_code": "USD",
  "effective_to": null,
  "timezone": "UTC",
  "weekday_mask": 127,
  "local_time_start": null,
  "local_time_end": null,
  "priority": 0,
  "enabled": true,
  "input_token_unit_size": 1000000,
  "input_token_unit_price": "0.75",
  "output_token_unit_size": 1000000,
  "output_token_unit_price": "3.75",
  "cache_hit_token_unit_size": 1000000,
  "cache_hit_token_unit_price": "0.075",
  "cache_write_token_unit_size": 1000000,
  "cache_write_token_unit_price": "0.041667",
  "id": "7910bdf0-36fd-479e-bc93-904d54adf1ef",
  "effective_from": "2026-10-31T02:01:38.612Z",
  "rules": [],
  "extensions": {
    "source": "community_pricing",
    "price_sync": {
      "synced_at": "2026-10-31T02:01:38.612Z",
      "meters": {
        "input": {
          "source": "models.dev",
          "provider": "kilo",
          "model": "~google/gemini-flash-latest",
          "field": "cost.input",
          "url": "https://models.dev/api.json"
        },
        "output": {
          "source": "models.dev",
          "provider": "kilo",
          "model": "~google/gemini-flash-latest",
          "field": "cost.output",
          "url": "https://models.dev/api.json"
        },
        "cache_hit": {
          "source": "models.dev",
          "provider": "kilo",
          "model": "~google/gemini-flash-latest",
          "field": "cost.cache_read",
          "url": "https://models.dev/api.json"
        },
        "cache_write": {
          "source": "models.dev",
          "provider": "kilo",
          "model": "~google/gemini-flash-latest",
          "field": "cost.cache_write",
          "url": "https://models.dev/api.json"
        }
      },
      "rules": []
    }
  }
}
